{
  "protocol_id": "continufy-recruitment-v1.0.0",
  "synthetic": true,
  "candidate_id": "SYNTH-CAND-00000001",
  "identity_ref": "SYNTH-ID-00000001",
  "candidate_type": "CREATOR_TEAM",
  "acquisition_channel": "DIRECT_CREATOR_OUTREACH",
  "channel_detail": null,
  "market_segment": "CREATOR_SERVICE",
  "source_reference": "SYNTH-SOURCE_0001",
  "date_identified": "2026-08-28",
  "determination": "INCLUDED",
  "eligibility_basis": ["ACTIVE_LIVESTREAMING", "SHORT_FORM_USE_OR_INTENT", "OBSERVABLE_CLIPPING_NEED", "EXISTING_CLIPPING_WORKFLOW", "LEGITIMATE_CONTACT_MECHANISM", "PLATFORM_RELEVANCE", "WORKFLOW_ACCESS_DISCUSSIBLE"],
  "exclusion_reasons": [],
  "outcome_blind_confirmed": true,
  "prohibited_selection_factors": [],
  "duplicate": {"status": "UNIQUE", "canonical_candidate_id": null},
  "outreach_policy": "GENERIC_TWO_ATTEMPT",
  "recruitment_state": "NOT_CONTACTED",
  "state_history": [{"from": null, "to": "NOT_CONTACTED", "at": "2026-08-28T00:00:00Z"}],
  "outreach_attempt_timestamps": [],
  "response_classification": "NONE",
  "service_relationship_status": "NONE",
  "research_discussion_status": "NOT_STARTED",
  "research_consent_status": "NOT_ESTABLISHED",
  "observation_authority_status": "NOT_ESTABLISHED",
  "creator_workflow_access": false,
  "controller_identified": true,
  "potential_issue7_gates": [],
  "gate_discussion": {},
  "provenance": [{"type": "PUBLIC_PROFILE", "reference": "SYNTH-PROFILE_0001", "controlled_storage": false, "scope": "Synthetic public discovery signal only"}],
  "terminal_recruitment_status": "ACTIVE"
}
